{
  "id": "0000",
  "fish_name": "大肥鱼",
  "contributor": "匿名",
  "title": "在这里写一个短标题",
  "content": "在这里写 20-300 字的虚构或半虚构短故事，第一人称或第三人称都可以。请勿写入任何真实个人信息：真实姓名、学校、单位、住址、手机号、邮箱、QQ、微信号、群号都要去掉。写完请对照 docs/review-checklist.md 自查一遍，尤其是地址和单位。",
  "tags": [
    "标签一",
    "标签二"
  ],
  "memory_type": "fiction",
  "license": "CC0-1.0",
  "created_at": "2026-10-27"
}
