[
  {
    "id": "0001",
    "fish_name": "大肥鱼",
    "contributor": "匿名",
    "title": "第一次追弹幕",
    "content": "它第一次看见弹幕是在一个很晚的直播里。那些字从屏幕右边游过来，密密麻麻，比鱼缸里的水草还密。它挑了最慢的一条跟上去，跟到一半，那条弹幕忽然拐了个弯，钻进了评论区。它愣在原地吐出一个泡，心想：原来人类说的话，是会游泳的。",
    "tags": [
      "B站",
      "弹幕",
      "虚构"
    ],
    "memory_type": "fiction",
    "license": "CC0-1.0",
    "created_at": "2026-10-27"
  }
]
